{
  "$schema": "https://json-schema.org/draft/2020-12/schema",
  "type": "object",
  "properties": {
    "schema": {
      "type": "string",
      "const": "intyy.testdata/1.0"
    },
    "tenant": {
      "type": "string",
      "pattern": "^[a-z][a-z0-9_-]*$"
    },
    "app": {
      "type": "string",
      "pattern": "^[a-z][a-z0-9_-]*$"
    },
    "revision": {
      "type": "integer",
      "exclusiveMinimum": 0,
      "maximum": 9007199254740991
    },
    "pools": {
      "type": "object",
      "propertyNames": {
        "type": "string",
        "pattern": "^[a-z][a-z0-9_]*(?:\\.[a-z][a-z0-9_]*)*$"
      },
      "additionalProperties": {
        "minItems": 1,
        "type": "array",
        "items": {
          "type": "string",
          "minLength": 1
        }
      }
    },
    "instance": {
      "type": "object",
      "properties": {
        "variant": {
          "type": "string",
          "minLength": 1
        },
        "strip_semantics": {
          "type": "boolean"
        },
        "drop_labels": {
          "type": "integer",
          "minimum": 0,
          "maximum": 9007199254740991
        },
        "label_seed": {
          "type": "string",
          "minLength": 1
        }
      },
      "required": [
        "variant",
        "strip_semantics",
        "drop_labels",
        "label_seed"
      ],
      "additionalProperties": false
    },
    "business_date": {
      "type": "string",
      "format": "date",
      "pattern": "^(?:(?:\\d\\d[2468][048]|\\d\\d[13579][26]|\\d\\d0[48]|[02468][048]00|[13579][26]00)-02-29|\\d{4}-(?:(?:0[13578]|1[02])-(?:0[1-9]|[12]\\d|3[01])|(?:0[469]|11)-(?:0[1-9]|[12]\\d|30)|(?:02)-(?:0[1-9]|1\\d|2[0-8])))$"
    },
    "approved": {
      "type": "object",
      "properties": {
        "by": {
          "type": "string",
          "minLength": 1
        },
        "at": {
          "type": "string",
          "format": "date-time",
          "pattern": "^(?:(?:\\d\\d[2468][048]|\\d\\d[13579][26]|\\d\\d0[48]|[02468][048]00|[13579][26]00)-02-29|\\d{4}-(?:(?:0[13578]|1[02])-(?:0[1-9]|[12]\\d|3[01])|(?:0[469]|11)-(?:0[1-9]|[12]\\d|30)|(?:02)-(?:0[1-9]|1\\d|2[0-8])))T(?:(?:[01]\\d|2[0-3]):[0-5]\\d:[0-5]\\d(?:\\.\\d+)?(?:Z))$"
        }
      },
      "required": [
        "by",
        "at"
      ],
      "additionalProperties": false
    }
  },
  "required": [
    "schema",
    "tenant",
    "app",
    "revision",
    "pools",
    "instance",
    "business_date"
  ],
  "additionalProperties": false
}
