{
  "schema": "intyy.testdata/1.0",
  "tenant": "keystone",
  "app": "kvfcu",
  "revision": 1,
  "pools": {
    "members.valid": [
      "100107",
      "100114",
      "100121",
      "100128",
      "100135",
      "100142",
      "100149",
      "100156",
      "100163",
      "100170",
      "100177",
      "100184",
      "100191",
      "100198",
      "100205",
      "100212",
      "100219",
      "100226",
      "100233"
    ],
    "members.at_limit": [
      "100247",
      "100254",
      "100261",
      "100268",
      "100275"
    ],
    "members.missing": [
      "999001",
      "100101",
      "100199",
      "100250",
      "123456"
    ]
  },
  "instance": {
    "variant": "keystone",
    "strip_semantics": false,
    "drop_labels": 0,
    "label_seed": "0"
  },
  "business_date": "2026-01-15"
}
